headline,body,time_published,Text,category
1st private space crew paying $55M each to fly to station,"CAPE CANAVERAL: The first private space station crew was introduced Tuesday: Three men who are each paying $55 million to fly on a SpaceX rocket.

They'll be led by a...",272021.0,st private space crew paying fly station cape canaveral first private space station crew introduced tuesday three men paying million fly spacex rocket. led a...,Mobile & Apps
"Moderna says COVID-19 vaccine apparently effective against UK, South Africa variants",KATHMANDU: US-based pharmaceutical and biotechnology company Moderna said on Monday that its vaccine is apparently effective in neutralising the UK and South Africa...,252021.0,moderna say covid vaccine apparently effective uk south africa variant kathmandu u based pharmaceutical biotechnology company moderna said monday vaccine apparently effective neutralising uk south africa...,Mobile & Apps
Personal details of 2.28 million users of dating site MeetMindful compromised,KATHMANDU: Privacy of as many as 2.28 million users of the online dating site MeetMindful has been compromised following publication of personal user data online on January...,252021.0,personal detail . million user dating site meetmindful compromised kathmandu privacy many . million user online dating site meetmindful compromised following publication personal user data online january...,Mobile & Apps
Need a lift? SpaceX launches record spacecraft in cosmic rideshare program,"A veteran rocket from billionaire entrepreneur Elon Musk’s SpaceX aerospace company launched 143 spacecraft into space on Sunday, a new record for the most spaceships...",252021.0,need lift spacex launch record spacecraft cosmic rideshare program veteran rocket billionaire entrepreneur elon musk spacex aerospace company launched spacecraft space sunday new record spaceships...,Mobile & Apps
"China's Chang'e 5 probe up for a new mission, to the sun","KATHMANDU: China stunned everyone last month when its lunar probe, Chang'e 5, succeeded to bring rocks and dust from the moon -- world's first lunar sample-return mission...",232021.0,china chang e probe new mission sun kathmandu china stunned everyone last month lunar probe chang e succeeded bring rock dust moon world first lunar sample return mission...,Mobile & Apps
Privacy fears as Indian city readies facial recognition to spot harassed women,"A plan to monitor women's expressions with facial recognition technology to prevent street harassment in a north Indian city, will lead to intrusive policing and privacy...",232021.0,privacy fear indian city ready facial recognition spot harassed woman plan monitor woman expression facial recognition technology prevent street harassment north indian city lead intrusive policing privacy...,Mobile & Apps
UK chief scientist says new virus variant may be more deadly,"LONDON: There is some evidence that a new coronavirus variant first identified in southeast England carries a higher risk of death than the original strain, the British...",232021.0,uk chief scientist say new virus variant may deadly london evidence new coronavirus variant first identified southeast england carry higher risk death original strain british...,Mobile & Apps
New Patagonian dinosaur may be largest yet: Scientists,"BUENOS AIRES, JANUARY 22

Scientists have unearthed massive, 98-million-year-old fossils in southwest Argentina they say may have belonged to the largest dinosaur ever...",232021.0,new patagonian dinosaur may largest yet scientist buenos aire january scientist unearthed massive million year old fossil southwest argentina say may belonged largest dinosaur ever...,Mobile & Apps
Fauci credits Biden for letting 'the science speak' as new administration puts focus on virus,"WASHINGTON: President Joe Biden unveiled sweeping measures to battle COVID-19 on his first full day in office on Thursday, with his chief medical adviser, Anthony Fauci,...",222021.0,fauci credit biden letting science speak new administration put focus virus washington president joe biden unveiled sweeping measure battle covid first full day office thursday chief medical adviser anthony fauci ...,Mobile & Apps
German researchers make paralysed mice walk again,"BERLIN: German researchers have enabled mice paralysed after spinal cord injuries to walk again, re-establishing a neural link hitherto considered irreparable in mammals by...",222021.0,german researcher make paralysed mouse walk berlin german researcher enabled mouse paralysed spinal cord injury walk establishing neural link hitherto considered irreparable mammal by...,Mobile & Apps
Chinese scientists develop gene therapy which could delay ageing,"BEIJING: Scientists in Beijing have developed a new gene therapy which can reverse some of the effects of ageing in mice and extend their lifespans, findings which may one...",202021.0,chinese scientist develop gene therapy could delay ageing beijing scientist beijing developed new gene therapy reverse effect ageing mouse extend lifespan finding may one...,Mobile & Apps
India asks Facebook's WhatsApp to withdraw privacy policy update,"NEW DELHI: India’s technology ministry has asked WhatsApp to withdraw changes to its privacy policy the messaging platform announced earlier this month, saying the new...",202021.0,india asks facebook whatsapp withdraw privacy policy update new delhi india technology ministry asked whatsapp withdraw change privacy policy messaging platform announced earlier month saying new...,Mobile & Apps
"Facebook to ban ads promoting weapon accessories, protective gear in US",Facebook Inc said on Saturday it will ban advertisements for weapon accessories and protective equipment in the United States with immediate effect until at least two days...,172021.0,facebook ban ad promoting weapon accessory protective gear u facebook inc said saturday ban advertisement weapon accessory protective equipment united state immediate effect least two days...,Mobile & Apps
NASA's Boeing moon rocket cuts short 'once-in-a-generation' ground test,"WASHINGTON: NASA’s deep space exploration rocket built by Boeing briefly ignited all four engines of its behemoth core stage for the first time on Saturday, cutting short...",172021.0,nasa boeing moon rocket cut short generation ground test washington nasa deep space exploration rocket built boeing briefly ignited four engine behemoth core stage first time saturday cutting short...,Mobile & Apps
RIP: Mars digger bites the dust after 2 years on red planet,"CAPE CANAVERAL: NASA declared the Mars digger dead Thursday after failing to burrow deep into the red planet to take its temperature.

Scientists in Germany spent two...",152021.0,rip mar digger bite dust year red planet cape canaveral nasa declared mar digger dead thursday failing burrow deep red planet take temperature. scientist germany spent two...,Mobile & Apps
Twitter CEO says banning Trump was right decision but sets dangerous precedent,Twitter Inc Chief Executive Jack Dorsey said on Wednesday that banning President Donald Trump from its social media platform after last week’s violence at the US Capitol...,142021.0,twitter ceo say banning trump right decision set dangerous precedent twitter inc chief executive jack dorsey said wednesday banning president donald trump social medium platform last week violence u capitol...,Mobile & Apps
"Gut bacteria tied to disease severity, immune response; high mental health toll seen in ICUs","The following is a roundup of some of the latest scientific studies on the novel coronavirus and efforts to find treatments and vaccines for COVID-19, the illness caused by...",142021.0,gut bacteria tied disease severity immune response high mental health toll seen icu following roundup latest scientific study novel coronavirus effort find treatment vaccine covid illness caused by...,Mobile & Apps
"Scientists decry death by 1,000 cuts for world's insects","The world’s vital insect kingdom is undergoing “death by a thousand cuts,” the world’s top bug experts said.

Climate change, insecticides, herbicides, light...",122021.0,scientist decry death cut world insect world vital insect kingdom undergoing death thousand cut world top bug expert said. climate change insecticide herbicide light...,Mobile & Apps
Pfizer study suggests vaccine works against virus variant,New research suggests that Pfizer’s COVID-19 vaccine can protect against a mutation found in two easier-to-spread variants of the coronavirus that erupted in Britain and...,82021.0,pfizer study suggests vaccine work virus variant new research suggests pfizer covid vaccine protect mutation found two easier spread variant coronavirus erupted britain and...,Mobile & Apps
"Planetary trio of Mercury, Jupiter, Saturn for grand evening around Jan 10","KATHMANDU: The astronomical calendar for 2021 is beginning with a splendid planetary triad of Mercury, Jupiter and Saturn- weeks after the great conjunction of the two...",62021.0,planetary trio mercury jupiter saturn grand evening around jan kathmandu astronomical calendar beginning splendid planetary triad mercury jupiter saturn week great conjunction two...,Mobile & Apps
"Microsoft says hackers viewed source code, didn't change it",Microsoft  said Thursday in a blog post that hackers tied to a massive intrusion of dozens of US government agencies and private companies sneaked further into its systems...,12021.0,microsoft say hacker viewed source code change microsoft said thursday blog post hacker tied massive intrusion dozen u government agency private company sneaked systems...,Mobile & Apps
Microsoft says it found malicious software in its systems,"SAN FRANCISCO: Microsoft Corp said on Thursday it found malicious software in its systems related to a massive hacking campaign disclosed by U.S. officials this week,...",182020.0,microsoft say found malicious software system san francisco microsoft corp said thursday found malicious software system related massive hacking campaign disclosed u.s. official week ...,Mobile & Apps
China says to share lunar samples with other countries,"BEIJING: China will share data and samples from the moon obtained by its Chang'e 5 probe on the basis of international conventions though ""unfortunate"" U.S. restrictions on...",172020.0,china say share lunar sample country beijing china share data sample moon obtained chang e probe basis international convention though unfortunate u.s. restriction on...,Mobile & Apps
Chinese capsule returns to Earth carrying moon rocks,"BEIJING: A Chinese lunar capsule returned to Earth on Thursday with the first fresh samples of rock and debris from the moon in more than 40 years, offering the possibility...",172020.0,chinese capsule return earth carrying moon rock beijing chinese lunar capsule returned earth thursday first fresh sample rock debris moon year offering possibility...,Mobile & Apps
China prepares for return of lunar probe with moon samples,BEIJING: Chinese ground crews are standing by for the return of a lunar probe bringing back the first fresh samples of rock and debris from the moon in more than 45...,162020.0,china prepares return lunar probe moon sample beijing chinese ground crew standing return lunar probe bringing back first fresh sample rock debris moon ...,Mobile & Apps
"Japan's space agency finds ample soil, gas from asteroid",TOKYO: Officials from Japan's space agency said Tuesday they have found more than the anticipated amount of soil and gases inside a small capsule the country's Hayabusa2...,162020.0,japan space agency find ample soil gas asteroid tokyo official japan space agency said tuesday found anticipated amount soil gas inside small capsule country hayabusa...,Mobile & Apps
"Samples from asteroid more than hoped for, Japan researchers say","TOKYO: Samples of dust collected by a Japanese space probe from an asteroid some 300 million km (186 million miles) from Earth were better than hoped for, with one...",162020.0,sample asteroid hoped japan researcher say tokyo sample dust collected japanese space probe asteroid million km million mile earth better hoped one...,Mobile & Apps
Daytime darkness: Total solar eclipse wows in Latin America,"CARAHUE, CHILE: Thousands of people gathered in the Chilean region of La Araucanía on Monday to witness a solar eclipse, rejoicing in the rare experience even though...",152020.0,daytime darkness total solar eclipse wow latin america carahue chile thousand people gathered chilean region la araucan monday witness solar eclipse rejoicing rare experience even though...,Mobile & Apps
Immune system can cause broad damage in COVID-19; dogs can detect coronavirus in people,"The following is a roundup of some of the latest scientific studies on the novel coronavirus and efforts to find treatments and vaccines for COVID-19, the illness caused by...",152020.0,immune system cause broad damage covid dog detect coronavirus people following roundup latest scientific study novel coronavirus effort find treatment vaccine covid illness caused by...,Mobile & Apps
Scientists focus on bats for clues to prevent next pandemic,RIO DE JANEIRO: Night began to fall in Rio de Janeiro’s Pedra Branca state park as four Brazilian scientists switched on their flashlights to traipse along a narrow trail...,152020.0,scientist focus bat clue prevent next pandemic rio de janeiro night began fall rio de janeiro pedra branca state park four brazilian scientist switched flashlight traipse along narrow trail...,Mobile & Apps
"Google's YouTube, Gmail recover after global outage","Google services, including YouTube, Gmail and Google Drive, were restored for most users on Monday, following a global outage that affected thousands.

Google's...",142020.0,google youtube gmail recover global outage google service including youtube gmail google drive restored user monday following global outage affected thousands. google s...,Mobile & Apps
COVID-19 simulator reveals combining extensive testing and contact tracing effective in suppressing virus,KATHMANDU: Scientists from the Institute of Smart Systems and Artificial Intelligence (ISSAI) at Nazarbayev University in Kazakhstan have discovered that joint use of mass...,142020.0,covid simulator reveals combining extensive testing contact tracing effective suppressing virus kathmandu scientist institute smart system artificial intelligence issai nazarbayev university kazakhstan discovered joint use mass...,Mobile & Apps
Chinese capsule with moon rocks begins return to Earth,"BEIJING: A Chinese space capsule bringing back the first moon rocks in more than four decades started its three-day return to Earth on Sunday.

The Chang'e 5 lunar probe,...",132020.0,chinese capsule moon rock begin return earth beijing chinese space capsule bringing back first moon rock four decade started three day return earth sunday. chang e lunar probe ...,Mobile & Apps
Researchers think they spotted new whale species off Mexico,"Researchers believe they have found a previously unknown species of beaked whale in waters off Mexico's western coast. If confirmed, the new species would mark a...",102020.0,researcher think spotted new whale specie mexico researcher believe found previously unknown specie beaked whale water mexico western coast. confirmed new specie would mark a...,Mobile & Apps
"SpaceX launches Starship on highest test flight, crash-lands","CAPE CANAVERAL: SpaceX launched its shiny, bullet-shaped, straight-out-of-science fiction Starship several miles into the air from a remote corner of Texas on Wednesday,...",102020.0,spacex launch starship highest test flight crash land cape canaveral spacex launched shiny bullet shaped straight science fiction starship several mile air remote corner texas wednesday ...,Mobile & Apps
"Facebook faces US lawsuits that could force sale of Instagram, WhatsApp",WASHINGTON: Facebook Inc could be forced to sell its prized assets WhatsApp and Instagram after the U.S. Federal Trade Commission and nearly every US state filed lawsuits...,102020.0,facebook face u lawsuit could force sale instagram whatsapp washington facebook inc could forced sell prized asset whatsapp instagram u.s. federal trade commission nearly every u state filed lawsuits...,Mobile & Apps
"First woman, next man on moon will come from these NASA 18","CAPE CANAVERAL: NASA has named the 18 astronauts — half of them women — who will train for its Artemis moon-landing program.

The first woman and next man on the moon...",102020.0,first woman next man moon come nasa cape canaveral nasa named astronaut half woman train artemis moon landing program. first woman next man moon...,Mobile & Apps
Musk's SpaceX scrubs key high-altitude Starship test,"WASHINGTON: A key test of SpaceX’s Mars rocket Starship was automatically aborted on Tuesday just one second before liftoff, postponing the first high-altitude test of a...",92020.0,musk spacex scrub key high altitude starship test washington key test spacex mar rocket starship automatically aborted tuesday one second liftoff postponing first high altitude test a...,Mobile & Apps
Millions of smart devices vulnerable to hacking: research,BOSTON: Researchers at a cybersecurity firm say they have identified vulnerabilities in software widely used by millions of connected devices — flaws that could be...,92020.0,million smart device vulnerable hacking research boston researcher cybersecurity firm say identified vulnerability software widely used million connected device flaw could be...,Mobile & Apps
"Apple to tighten app privacy, remove apps that don't comply","LONDON: Apple is stepping up privacy for app users, forcing developers to be more transparent about data collection and warning they could be removed if they don't comply...",92020.0,apple tighten app privacy remove apps comply london apple stepping privacy app user forcing developer transparent data collection warning could removed comply...,Mobile & Apps
Chinese probe prepares to return moon rocks to Earth,BEIJING: A Chinese probe that landed on the moon transferred rocks to an orbiter Sunday in preparation for returning samples of the lunar surface to Earth for the first...,72020.0,chinese probe prepares return moon rock earth beijing chinese probe landed moon transferred rock orbiter sunday preparation returning sample lunar surface earth first...,Mobile & Apps
Japanese space officials eager to analyze asteroid samples,TOKYO: Japanese space officials said they are excited about the return of a capsule that landed safely in the Australian Outback on Sunday while carrying soil samples from...,72020.0,japanese space official eager analyze asteroid sample tokyo japanese space official said excited return capsule landed safely australian outback sunday carrying soil sample from...,Mobile & Apps
Great conjunction 2020 happening on December 21,"KATHMANDU: A special and rare astronomical event is heading our way, slated to take place this December solstice - The Great Conjunction 2020.

Towards the end of 2020,...",62020.0,great conjunction happening december kathmandu special rare astronomical event heading way slated take place december solstice great conjunction . towards end ...,Mobile & Apps
Bezos says Blue Origin will take the first woman to moon's surface,"Jeff Bezos' space company Blue Origin will take the first woman to the moon's surface, the billionaire said on Friday as NASA nears a decision to pick its first privately...",62020.0,bezos say blue origin take first woman moon surface jeff bezos space company blue origin take first woman moon surface billionaire said friday nasa nears decision pick first privately...,Mobile & Apps
Japan retrieves space probe that may hold clues to origin of planets,"Capsule from Hayabusa2 lit up Australian sky
 	First time extensive asteroid samples brought to Earth
 	Mission aims to answer questions about origins of...",62020.0,japan retrieves space probe may hold clue origin planet capsule hayabusa lit australian sky first time extensive asteroid sample brought earth mission aim answer question origin of...,Mobile & Apps
Gene-editing treatment shows promise for sickle cell disease,"Scientists are seeing promising early results from the first studies testing gene editing for painful, inherited blood disorders that plague millions worldwide, especially...",62020.0,gene editing treatment show promise sickle cell disease scientist seeing promising early result first study testing gene editing painful inherited blood disorder plague million worldwide especially...,Mobile & Apps
Vision-restoring brain implants spell breakthrough,"WASHINGTON, DECEMBER 4

Scientists are a step closer to restoring vision for the blind, after building an implant that bypasses the eyes and allows monkeys to perceive...",52020.0,vision restoring brain implant spell breakthrough washington december scientist step closer restoring vision blind building implant bypass eye allows monkey perceive...,Mobile & Apps
Chinese spacecraft carrying lunar rocks lifts off from moon,"BEIJING: A Chinese spacecraft lifted off from the moon Thursday night with a load of lunar rocks, the first stage of its return to Earth, the government space agency...",42020.0,chinese spacecraft carrying lunar rock lift moon beijing chinese spacecraft lifted moon thursday night load lunar rock first stage return earth government space agency...,Mobile & Apps
"Mystery object is 54-year-old rocket, not asteroid: NASA","CAPE CANAVERAL: A mysterious object temporarily orbiting Earth is a 54-year-old rocket, not an asteroid after all, astronomers confirmed Wednesday.

Observations by a...",32020.0,mystery object year old rocket asteroid nasa cape canaveral mysterious object temporarily orbiting earth year old rocket asteroid astronomer confirmed wednesday. observation a...,Mobile & Apps
Moon probe preparing to return rock samples to Earth: China,"BEIJING: China said Thursday its latest lunar probe has finished taking samples of the moon's surface and sealed them within the spacecraft for return to Earth, the first...",32020.0,moon probe preparing return rock sample earth china beijing china said thursday latest lunar probe finished taking sample moon surface sealed within spacecraft return earth first...,Mobile & Apps
Australian telescope maps deep space at record speed,"MELBOURNE: A powerful new telescope in outback Australia has mapped vast areas of the universe in record-breaking time, revealing a million new galaxies and opening the way...",32020.0,australian telescope map deep space record speed melbourne powerful new telescope outback australia mapped vast area universe record breaking time revealing million new galaxy opening way...,Mobile & Apps
"China's space ambitions: robot on Mars, a human on the moon","BEIJING: China's landing of its third probe on the moon is part of an increasingly ambitious space program that has a robot rover en route to Mars, is developing a reusable...",22020.0,china space ambition robot mar human moon beijing china landing third probe moon part increasingly ambitious space program robot rover en route mar developing reusable...,Mobile & Apps
Massive Puerto Rico telescope featured in James Bond movie collapses,"A massive radio telescope at Puerto Rico's Arecibo Observatory - one of the world's largest - collapsed on Tuesday after sustaining severe damage since August, officials...",22020.0,massive puerto rico telescope featured james bond movie collapse massive radio telescope puerto rico arecibo observatory one world largest collapsed tuesday sustaining severe damage since august officials...,Mobile & Apps
China spacecraft lands on moon to bring rocks back to Earth,"BEIJING: A Chinese spacecraft sent to return lunar rocks to Earth collected its first samples Wednesday after landing on the moon, the government announced, adding to a...",22020.0,china spacecraft land moon bring rock back earth beijing chinese spacecraft sent return lunar rock earth collected first sample wednesday landing moon government announced adding a...,Mobile & Apps
When and which COVID-19 vaccines are likely to be available in Asia,"MELBOURNE: Trial data from Pfizer Inc with partner BioNTech SE, Moderna Inc and AstraZeneca Plc has shown their experimental vaccines are effective in preventing the...",12020.0,covid vaccine likely available asia melbourne trial data pfizer inc partner biontech se moderna inc astrazeneca plc shown experimental vaccine effective preventing the...,Mobile & Apps
2020's last lunar eclipse to be witnessed on November  30,"KATHMANDU: The last lunar eclipse of 2020, a Penumbral one in which the moon passes through Earth's outer shadow, is on November 30.

A penumbral lunar eclipse is less...",292020.0,last lunar eclipse witnessed november kathmandu last lunar eclipse penumbral one moon pass earth outer shadow november . penumbral lunar eclipse less...,Mobile & Apps
Tesla could widen release of 'self-driving' software in two weeks,"Tesla Inc Chief Executive Officer Elon Musk said on Friday there will probably be a wider roll out of a new ""Full Self Driving"" software update in two weeks.


In...",282020.0,tesla could widen release self driving software two week tesla inc chief executive officer elon musk said friday probably wider roll new full self driving software update two weeks. in...,Mobile & Apps
UK to launch new watchdog next year to police tech giants,LONDON: Britain plans to create a new watchdog to police big tech companies including Google and Facebook to counter their market dominance and prevent them from exploiting...,272020.0,uk launch new watchdog next year police tech giant london britain plan create new watchdog police big tech company including google facebook counter market dominance prevent exploiting...,Mobile & Apps
