headline,body,time_published,Text,category
"Apple-Google contact tracing tech draws interest in 23 countries, some hedge bets","OAKLAND: Authorities in 23 countries across five continents have sought access to contact tracing technology from Apple Inc and Alphabet Inc’s Google, the companies...",212020.0,apple google contact tracing tech draw interest country hedge bet oakland authority country across five continent sought access contact tracing technology apple inc alphabet inc google companies...,Mobile & Apps
Astronauts arrive for NASA's 1st home launch in decade,"CAPE CANAVERAL: The two astronauts who will end a nine-year launch drought for NASA arrived at Kennedy Space Center on Wednesday, exactly one week before their historic...",212020.0,astronaut arrive nasa st home launch decade cape canaveral two astronaut end nine year launch drought nasa arrived kennedy space center wednesday exactly one week historic...,Mobile & Apps
"Reports suggest NASA finds evidence of parallel universe- Yes, No?","According to some media reports, a team of NASA scientists have said that the evidence of a parallel universe, where the rules of physics might work opposite from that of...",212020.0,report suggest nasa find evidence parallel universe yes according medium report team nasa scientist said evidence parallel universe rule physic might work opposite of...,Mobile & Apps
Estonia�starts�testing�digital�immunity�passport�for�workplaces,"TALLINN: Estonia has started to test one of the world's first digital immunity passports, created by a team including founders of global tech startups Transferwise and...",202020.0,estonia start testing digital immunity passport workplace tallinn estonia started test one world first digital immunity passport created team including founder global tech startup transferwise and...,Mobile & Apps
Disney's streaming chief Mayer to become TikTok CEO,"Walt Disney Co’s (DIS.N) top streaming executive, Kevin Mayer, will leave the entertainment and theme parks giant to become the chief executive officer of TikTok, the...",192020.0,disney streaming chief mayer become tiktok ceo walt disney co dis.n top streaming executive kevin mayer leave entertainment theme park giant become chief executive officer tiktok the...,Mobile & Apps
"Apple reopening 25 more US stores, will soon top 100 worldwide","Apple Inc will this week reopen more than 25 of its branded stores in the United States, the company said on Sunday, continuing a gradual process that has unlocked doors at...",182020.0,apple reopening u store soon top worldwide apple inc week reopen branded store united state company said sunday continuing gradual process unlocked door at...,Mobile & Apps
Sister Robot: Nepal�s answer to COVID-19 treatment in isolation ward,"Kathmandu

Bikash Gurung, President of Robotic Association of Nepal (RAN), was happy to see nurses excited to use Sister Robot in Hetaunda Hospital for medicine and food...",162020.0,sister robot nepal answer covid treatment isolation ward kathmandu bikash gurung president robotic association nepal ran happy see nurse excited use sister robot hetaunda hospital medicine food...,Mobile & Apps
Statins may help older coronavirus patients avoid symptoms; COVID-19 more than respiratory illness,"NEW YORK: The following is a brief roundup of some of the latest scientific studies on the novel coronavirus and efforts to find treatments and vaccines for COVID-19, the...",162020.0,statin may help older coronavirus patient avoid symptom covid respiratory illness new york following brief roundup latest scientific study novel coronavirus effort find treatment vaccine covid the...,Mobile & Apps
"Facebook buys Giphy, popular tool for creating animated GIFs","Facebook has bought Giphy, a popular tool for creating the animated images known as GIFs that pepper conversations around the internet.

The companies did not disclose...",162020.0,facebook buy giphy popular tool creating animated gifs facebook bought giphy popular tool creating animated image known gifs pepper conversation around internet. company disclose...,Mobile & Apps
Twin antibodies may help fight coronavirus; normal speech may spread virus,"The following is a brief roundup of the latest scientific studies on the novel coronavirus and efforts to find treatments and vaccines for COVID-19, the illness caused by...",142020.0,twin antibody may help fight coronavirus normal speech may spread virus following brief roundup latest scientific study novel coronavirus effort find treatment vaccine covid illness caused by...,Mobile & Apps
Cats with no symptoms spread virus to other cats in lab test,"Cats can spread the new coronavirus to other cats without any of them ever having symptoms, a lab experiment suggests.

Scientists who led the work, reported on...",142020.0,cat symptom spread virus cat lab test cat spread new coronavirus cat without ever symptom lab experiment suggests. scientist led work reported on...,Mobile & Apps
Bulgarian fossils show early arrival of Homo sapiens into Europe,"WASHINGTON: Fragmentary bone fossils and a molar found in Bulgaria dated to roughly 45,000 years ago show that Homo sapiens populations swept into Europe — until then a...",122020.0,bulgarian fossil show early arrival homo sapiens europe washington fragmentary bone fossil molar found bulgaria dated roughly year ago show homo sapiens population swept europe a...,Mobile & Apps
Closest black hole to Earth has two partners in surprising celestial marriage,WASHINGTON: Astronomers have spotted the closest black hole to Earth ever discovered and are surprised about its living arrangements - residing harmoniously with two...,112020.0,closest black hole earth two partner surprising celestial marriage washington astronomer spotted closest black hole earth ever discovered surprised living arrangement residing harmoniously two...,Mobile & Apps
"Facebook, YouTube remove 'Plandemic' video with 'unsubstantiated' coronavirus claims","Facebook Inc and YouTube, the video service of Alphabet Inc's Google, said on Thursday that they were removing a video that made medically unsubstantiated claims relating...",82020.0,facebook youtube remove plandemic video unsubstantiated coronavirus claim facebook inc youtube video service alphabet inc google said thursday removing video made medically unsubstantiated claim relating...,Mobile & Apps
COVID-19 and much-maligned bats,"Kathmandu 

This isn’t the first time that bats have been blamed for a human coronavirus. They still get the primary blame for MERS, SARS and Ebola,” opines Pushpa...",72020.0,covid much maligned bat kathmandu first time bat blamed human coronavirus. still get primary blame mers sars ebola opines pushpa...,Mobile & Apps
Trump administration drafting 'Artemis Accords' pact for moon mining,"WASHINGTON: The Trump administration is drafting a legal blueprint for mining on the moon under a new US-sponsored international agreement called the Artemis Accords,...",62020.0,trump administration drafting artemis accord pact moon mining washington trump administration drafting legal blueprint mining moon new u sponsored international agreement called artemis accord ...,Mobile & Apps
"Belgian, US scientists look to llama in search for COVID-19 treatment","BRUSSELS: A llama called Winter could prove useful in the hunt for a treatment for COVID-19, according to US and Belgian scientists who have identified a tiny particle that...",62020.0,belgian u scientist look llama search covid treatment brussels llama called winter could prove useful hunt treatment covid according u belgian scientist identified tiny particle that...,Mobile & Apps
China plans to complete space station by 2022,"BEIJING: China plans to send four crewed space missions and the same number of cargo craft to complete work on its permanent space station within about two years, officials...",62020.0,china plan complete space station beijing china plan send four crewed space mission number cargo craft complete work permanent space station within two year officials...,Mobile & Apps
Here come COVID-19 tracing apps -- and privacy trade-offs,"As governments around the world consider how to monitor new coronavirus outbreaks while reopening their societies, many are starting to bet on smartphone apps to help...",52020.0,come covid tracing apps privacy trade offs government around world consider monitor new coronavirus outbreak reopening society many starting bet smartphone apps help...,Mobile & Apps
"Apple, Google ban use of location tracking in contact tracing apps",Apple Inc and Alphabet Inc’s Google on Monday said they would ban the use of location tracking in apps that use a new contact tracing system the two are building to help...,52020.0,apple google ban use location tracking contact tracing apps apple inc alphabet inc google monday said would ban use location tracking apps use new contact tracing system two building help...,Mobile & Apps
Virus-afflicted 2020 looks like 1918 despite science's march,"WASHINGTON: Despite a century's progress in science, 2020 is looking a lot like 1918.

In the years between two lethal pandemics, one the misnamed Spanish flu, the other...",52020.0,virus afflicted look like despite science march washington despite century progress science looking lot like . year two lethal pandemic one misnamed spanish flu other...,Mobile & Apps
Zoom admits it does not have 300 mln daily users: the Verge,"Zoom video conferencing app does not have 300 million daily active users, the company admitted on Thursday to the Verge, saying it “unintentionally” referred to daily...",302020.0,zoom admits mln daily user verge zoom video conferencing app million daily active user company admitted thursday verge saying unintentionally referred daily...,Mobile & Apps
Oracle wins cloud computing deal with Zoom as video calls surge,Zoom Video Communications Inc said on Tuesday it has started using Oracle Corp's cloud computing service to help handle the surge in online video call volumes brought on by...,292020.0,oracle win cloud computing deal zoom video call surge zoom video communication inc said tuesday started using oracle corp cloud computing service help handle surge online video call volume brought by...,Mobile & Apps
Pentagon releases �UFO� videos taken by US Navy pilots,"Washington, April 28 

The Pentagon has officially released three videos taken by US Navy pilots showing mid-air encounters with what appear to be UFOs.

The grainy...",292020.0,pentagon release ufo video taken u navy pilot washington april pentagon officially released three video taken u navy pilot showing mid air encounter appear ufos. grainy...,Mobile & Apps
Ramadan bazaars go digital in Southeast Asia amid pandemic,"KUALA LUMPUR: For 15 years, Siti Zabedah Abdul Wahab’s family food business has opened for one month a year, selling murtabak, a pan-fried bread stuffed with meat, at...",282020.0,ramadan bazaar go digital southeast asia amid pandemic kuala lumpur year siti zabedah abdul wahab family food business opened one month year selling murtabak pan fried bread stuffed meat at...,Mobile & Apps
"Sunlight destroys coronavirus quickly, say US scientists","Washington, April 24 

The new coronavirus is quickly destroyed by sunlight, according to new research announced by a senior US official day, though the study has not yet...",252020.0,sunlight destroys coronavirus quickly say u scientist washington april new coronavirus quickly destroyed sunlight according new research announced senior u official day though study yet...,Mobile & Apps
"From guns to GoPros, Asian Americans seek to deter attacks","When Eddie Song leaves his Manhattan home, it can feel like heading into battle. The Korean American startup founder and avid rider dons his armored motorcycle jacket,...",252020.0,gun gopros asian american seek deter attack eddie song leaf manhattan home feel like heading battle. korean american startup founder avid rider don armored motorcycle jacket ...,Mobile & Apps
China unveils name of first Mars exploration mission,"BEIJING: China's space agency on Friday unveiled the name of its first Mars exploration mission, coinciding with China's annual Space Day and the 50th anniversary of the...",242020.0,china unveils name first mar exploration mission beijing china space agency friday unveiled name first mar exploration mission coinciding china annual space day th anniversary the...,Mobile & Apps
"Apple says ""no evidence"" iPhone mail flaw used against customers","Apple Inc said on Thursday it has found ""no evidence"" a flaw in its email app for iPhones and iPads has been used against customers, and that it believes the flaw does ""not...",242020.0,apple say evidence iphone mail flaw used customer apple inc said thursday found evidence flaw email app iphones ipads used customer belief flaw not...,Mobile & Apps
Zoom boosts encryption to quell safety concerns as users top 300 mln,Zoom Video Communications Inc said on Wednesday it was upgrading the encryption features on its video conferencing app to quell safety concerns as its users surged by 50%...,232020.0,zoom boost encryption quell safety concern user top mln zoom video communication inc said wednesday upgrading encryption feature video conferencing app quell safety concern user surged ...,Mobile & Apps
"Flaw in iPhone, iPads may have allowed hackers to steal data for years","WASHINGTON/SAN FRANCISCO: Apple Inc is planning to fix a flaw that a security firm said may have left more than half a billion iPhones vulnerable to hackers.

The bug,...",232020.0,flaw iphone ipads may allowed hacker steal data year washington san francisco apple inc planning fix flaw security firm said may left half billion iphones vulnerable hackers. bug ...,Mobile & Apps
Germany approves trials of COVID-19 vaccine candidate,"BERLIN: Germany gave the green light for human trials of potential coronavirus vaccines developed by German biotech company BioNTech, which is racing teams in Germany, the...",222020.0,germany approves trial covid vaccine candidate berlin germany gave green light human trial potential coronavirus vaccine developed german biotech company biontech racing team germany the...,Mobile & Apps
Ancient marine crocs adapted like whales to ocean life - only earlier,WASHINGTON: A wondrous lineage of crocodile relatives that developed into fast-swimming seagoing predators at a time when dinosaurs dominated the land adapted to life in...,212020.0,ancient marine crocs adapted like whale ocean life earlier washington wondrous lineage crocodile relative developed fast swimming seagoing predator time dinosaur dominated land adapted life in...,Mobile & Apps
Ventilator from old car parts? Afghan girls pursue prototype,"KABUL, AFGHANISTAN: On most mornings, Somaya Farooqi and four other teen-age girls pile into her dad's car and head to a mechanic's workshop. They use back roads to skirt...",192020.0,ventilator old car part afghan girl pursue prototype kabul afghanistan morning somaya farooqi four teen age girl pile dad car head mechanic workshop. use back road skirt...,Mobile & Apps
ISS crew lands in Kazakhstan after more than 200 days,"MOSCOW: A US-Russian space crew landed safely Friday in the steppes of Kazakhstan, greeted with extra precautions amid the coronavirus pandemic.

Following a stint on the...",172020.0,i crew land kazakhstan day moscow u russian space crew landed safely friday steppe kazakhstan greeted extra precaution amid coronavirus pandemic. following stint the...,Mobile & Apps
"Report says COVID-19 patients respond to Gilead's remdesivir, shares surge",Gilead Sciences Inc's shares surged 16% in after hours trading on Thursday following a media report detailing encouraging partial data from trials of the US company's...,172020.0,report say covid patient respond gilead remdesivir share surge gilead science inc share surged hour trading thursday following medium report detailing encouraging partial data trial u company s...,Mobile & Apps
Chile astronomers discover star dancing according to Einstein�s century-old theory,"SANTIAGO: Astronomers in Chile using one of the world's largest telescopes have found a star ""dancing"" around a black hole in the Milky Way just as Albert Einstein might...",172020.0,chile astronomer discover star dancing according einstein century old theory santiago astronomer chile using one world largest telescope found star dancing around black hole milky way albert einstein might...,Mobile & Apps
Cigar-shaped interstellar trespasser may be fragment of wrecked planet,WASHINGTON: A reddish-colored cigar-shaped interstellar object called 'Oumuamua that is tumbling through our solar system may be wreckage from a planet ripped apart when it...,152020.0,cigar shaped interstellar trespasser may fragment wrecked planet washington reddish colored cigar shaped interstellar object called oumuamua tumbling solar system may wreckage planet ripped apart it...,Mobile & Apps
Space scientists use COVID-19 lockdown as dry run for Mars mission,"TOULOUSE: French space scientists are using the COVID-19 lockdown as a dry run for what it will be like to be cooped up inside a space craft on a mission to Mars.

The...",152020.0,space scientist use covid lockdown dry run mar mission toulouse french space scientist using covid lockdown dry run like cooped inside space craft mission mars. the...,Mobile & Apps
How smartphone apps can help 'contact trace' the new coronavirus,"OAKLAND, CALIFORNIA: A global race is on to develop smartphone apps and other types of mobile phone surveillance systems to track and contain the spread of the novel...",152020.0,smartphone apps help contact trace new coronavirus oakland california global race develop smartphone apps type mobile phone surveillance system track contain spread novel...,Mobile & Apps
Scientists enthralled by biggest star explosion ever observed,"WASHINGTON: Scientists have observed the biggest supernova - stellar explosion - ever detected, the violent death of a huge star up to 100 times more massive than our sun...",152020.0,scientist enthralled biggest star explosion ever observed washington scientist observed biggest supernova stellar explosion ever detected violent death huge star time massive sun...,Mobile & Apps
Singapore stops teachers using Zoom app after 'very serious incidents',"SINGAPORE: Singapore has suspended the use of video-conferencing tool Zoom by teachers after ""very serious incidents"" in the first week of a coronavirus lockdown that...",112020.0,singapore stop teacher using zoom app serious incident singapore singapore suspended use video conferencing tool zoom teacher serious incident first week coronavirus lockdown that...,Mobile & Apps
"Apple, Google to harness phones for virus infection tracking","Apple and Google fueled hopes for digital technologyâ€™s promise against a fast-moving, invisible killer, announcing a joint effort to help public health agencies worldwide...",112020.0,apple google harness phone virus infection tracking apple google fueled hope digital technology promise fast moving invisible killer announcing joint effort help public health agency worldwide...,Mobile & Apps
Largest supermoon of 2020 rises on a world battling COVID-19,"The largest, brightest supermoon of 2020 rose in the night sky on Tuesday over hushed cities, stilled factories and countries in lockdown due to the novel coronavirus that...",82020.0,largest supermoon rise world battling covid largest brightest supermoon rose night sky tuesday hushed city stilled factory country lockdown due novel coronavirus that...,Mobile & Apps
Fossil teeth yield oldest genetic material from extinct human species,"WASHINGTON: Scientists have extracted from dental enamel the oldest human genetic material ever obtained, helping clarify the pivotal place in the human evolutionary...",72020.0,fossil teeth yield oldest genetic material extinct human specie washington scientist extracted dental enamel oldest human genetic material ever obtained helping clarify pivotal place human evolutionary...,Mobile & Apps
Formula One team helps develop breathing aid for COVID-19 patients,"London, April 3

Medical researchers and engineers have teamed up with Formula One outfit Mercedes to adapt a breathing aid for mass production that could keep...",42020.0,formula one team help develop breathing aid covid patient london april medical researcher engineer teamed formula one outfit mercedes adapt breathing aid mass production could keep...,Mobile & Apps
Chilean telescopes that explore galaxies brought down to earth by coronavirus,"SANTIAGO: Chilean telescopes that comb the skies seeking answers about some of the universeÂ´s most fundamental questions have confirmed they, too, have fallen victim to...",32020.0,chilean telescope explore galaxy brought earth coronavirus santiago chilean telescope comb sky seeking answer universe fundamental question confirmed fallen victim to...,Mobile & Apps
Fujifilm says new coronavirus test can produce results in two hours,"TOKYO: Fujifilm Holdings Corp said it has developed a new, faster test for the novel coronavirus that causes the COVID-19 disease, reducing the time of results delivery to...",32020.0,fujifilm say new coronavirus test produce result two hour tokyo fujifilm holding corp said developed new faster test novel coronavirus cause covid disease reducing time result delivery to...,Mobile & Apps
Google releases location data to show if coronavirus lockdowns working in 131 countries,"OAKLAND: Alphabet Inc's Google on Thursday published reports for 131 countries showing whether visits to shops, parks and workplaces dropped in March, when many...",32020.0,google release location data show coronavirus lockdown working country oakland alphabet inc google thursday published report country showing whether visit shop park workplace dropped march many...,Mobile & Apps
Astronomers spot 'missing link' black hole - not too big and not too small,"WASHINGTON: Scientists have detected a mid-size black hole - considered the ""missing link"" in the understanding of these celestial brutes - eviscerating an unfortunate star...",32020.0,astronomer spot missing link black hole big small washington scientist detected mid size black hole considered missing link understanding celestial brute eviscerating unfortunate star...,Mobile & Apps
Mother of invention: the new gadgets dreamt up to fight coronavirus,"LONDON/OAKLAND/BUCHAREST: Driving to work at his factory to the west of London last week, designer Steve Brooks had coronavirus on his mind. What could he make that would...",12020.0,mother invention new gadget dreamt fight coronavirus london oakland bucharest driving work factory west london last week designer steve brook coronavirus mind. could make would...,Mobile & Apps
"J&J, Moderna sign deals with US to produce huge quantity of possible coronavirus vaccines",The US government has cut deals with Johnson & Johnson and Moderna Inc and said it is in talks with at least two other companies to prepare them to produce massive...,12020.0,j j moderna sign deal u produce huge quantity possible coronavirus vaccine u government cut deal johnson johnson moderna inc said talk least two company prepare produce massive...,Mobile & Apps
BPKIHS to begin tests for Covid-19 today,"DHARAN: BPKIHS (BP Koirala Institute of Health Sciences) has started conducting Covid-19 tests to help detect coronavirus from the collected samples, today.

The...",302020.0,bpkihs begin test covid today dharan bpkihs bp koirala institute health science started conducting covid test help detect coronavirus collected sample today. the...,Mobile & Apps
Abbott wins US approval for test that can detect coronavirus in minutes,Abbott Laboratories said on Friday it won US marketing approval for a diagnostic test for the coronavirus that can deliver results to patients within minutes and be used in...,282020.0,abbott win u approval test detect coronavirus minute abbott laboratory said friday u marketing approval diagnostic test coronavirus deliver result patient within minute used in...,Mobile & Apps
Musk's SpaceX wins NASA award to supply planned lunar space station,"NASA on Friday picked a new space capsule from Elon Musk's SpaceX to ferry cargo and supplies to the agency's planned lunar space station, a crucial building block to its...",282020.0,musk spacex win nasa award supply planned lunar space station nasa friday picked new space capsule elon musk spacex ferry cargo supply agency planned lunar space station crucial building block its...,Mobile & Apps
Astronomical society urges people to provide evidence on sighting,"KATHMANDU: The Nepal Astronomical Society has urged Gandaki province residents to provide further evidence on an unknown object observed entering the atmosphere from space,...",272020.0,astronomical society urge people provide evidence sighting kathmandu nepal astronomical society urged gandaki province resident provide evidence unknown object observed entering atmosphere space ...,Mobile & Apps
Cybersecurity experts come together to fight coronovirus-related hacking,SAN FRANCISCO: An international group of nearly 400 volunteers with expertise inÂ cybersecurityÂ formed on Wednesday to fight hacking related to the novel...,262020.0,cybersecurity expert come together fight coronovirus related hacking san francisco international group nearly volunteer expertise cybersecurity formed wednesday fight hacking related novel...,Mobile & Apps
Facebook to cut video streaming quality in virus-hit Europe,"BRUSSELS: Facebook will downgrade video streaming quality on its platform and on Instagram in Europe, the latest US tech giant to respond to an EU call to stave off...",232020.0,facebook cut video streaming quality virus hit europe brussels facebook downgrade video streaming quality platform instagram europe latest u tech giant respond eu call stave off...,Mobile & Apps
