headline,body,time_published,Text,category
"Look out, Mars: Here we come with a fleet of spacecraft","CAPE CANAVERAL: Mars is about to be invaded by planet Earth â€” big time.

Three countries â€” the United States, China and the United Arab Emirates â€” are sending...",132020.0,look mar come fleet spacecraft cape canaveral mar invaded planet earth big time. three country united state china united arab emirate sending...,Mobile & Apps
A space odyssey: Britain rockets into unknown with OneWeb,TOKYO: Britain is betting that satellite operator OneWeb will help it boldly go into a post-Brexit era. But it faces formidable challenges to complete a working...,102020.0,space odyssey britain rocket unknown oneweb tokyo britain betting satellite operator oneweb help boldly go post brexit era. face formidable challenge complete working...,Mobile & Apps
New google machine at FCC could be Android TV dongle or Nest speaker,"KATHMANDU: Concerns and curiosity have gathered over a new Google machine that appeared at the office of Federal Communications Commission (FCC) of the United States,...",92020.0,new google machine fcc could android tv dongle nest speaker kathmandu concern curiosity gathered new google machine appeared office federal communication commission fcc united state ...,Mobile & Apps
"Comet Neowise swings close to earth, was visible to naked eye","KATHMANDU: Comet Neowise, officially known as C/2020 F3, was seen with the naked eyes as it made its initial approach to the sun.

Astronaut Bob Behnken shared several...",92020.0,comet neowise swing close earth visible naked eye kathmandu comet neowise officially known c f seen naked eye made initial approach sun. astronaut bob behnken shared several...,Mobile & Apps
"Tesla 'very close' to level 5 autonomous driving technology, Musk says","SHANGHAI/BEIJING: US electric vehicle maker Tesla Inc is ""very close"" to achieving level 5 autonomous driving technology, Chief Executive Elon Musk said on Thursday,...",92020.0,tesla close level autonomous driving technology musk say shanghai beijing u electric vehicle maker tesla inc close achieving level autonomous driving technology chief executive elon musk said thursday ...,Mobile & Apps
"Serious brain disorders in patients with mild Covid-19 symptoms, warn UK neurologists",KATHMANDU: UK neurologists have warned that serious and potentially deadly brain disorder might be triggered among patients with mild Covid-19 symptoms or recovering...,82020.0,serious brain disorder patient mild covid symptom warn uk neurologist kathmandu uk neurologist warned serious potentially deadly brain disorder might triggered among patient mild covid symptom recovering...,Mobile & Apps
'Desperation science' slows the hunt for coronavirus drugs,"Desperate to solve the deadly conundrum of COVID-19, the world is clamoring for fast answers and solutions from a research system not built for haste.

The ironic, and...",82020.0,desperation science slows hunt coronavirus drug desperate solve deadly conundrum covid world clamoring fast answer solution research system built haste. ironic and...,Mobile & Apps
Australian scientists discover ancient underwater Aboriginal sites,"SYDNEY: Australia's firstÂ underwaterÂ archaeologicalÂ sitesÂ off its west coast dating to more than 7,000 years ago will help with the understanding of the cultural and...",22020.0,australian scientist discover ancient underwater aboriginal site sydney australia first underwater archaeological site west coast dating year ago help understanding cultural and...,Mobile & Apps
How to rid East Africa of locusts? Serve them in a kebab or drive them to cannibalism,"NAIROBI: EatÂ them, poisonÂ them, and use scent toÂ driveÂ themÂ toÂ cannibalismÂ - as a second wave of locusts threatens to devourÂ EastÂ Africa's crops, scientists in a...",22020.0,rid east africa locust serve kebab drive cannibalism nairobi eat poison use scent drive cannibalism second wave locust threatens devour east africa crop scientist a...,Mobile & Apps
Surviving core of ill-fated Jupiter-like planet spotted near distant star,"WASHINGTON: A rockyÂ planetÂ 39 times as massive as Earth has beenÂ spottedÂ orbiting aÂ distantÂ starÂ at breakneck speed, with astronomers concluding it may be...",22020.0,surviving core ill fated jupiter like planet spotted near distant star washington rocky planet time massive earth spotted orbiting distant star breakneck speed astronomer concluding may be...,Mobile & Apps
NASA TV go live with their ISS spacewalk broadcast,"KATHMANDU: NASA is broadcasting live International Space Station (ISS) expedition on a SpaceXâ€™s Crew Dragon, being performed by NASA astronauts Chris Cassidy and Robert...",12020.0,nasa tv go live i spacewalk broadcast kathmandu nasa broadcasting live international space station i expedition spacex crew dragon performed nasa astronaut chris cassidy robert...,Mobile & Apps
Tentacles on cells may help virus spread to other cells,"The following is a brief roundup of some of the latest scientific studies on the novel coronavirus and efforts to find treatments and vaccines for COVID-19, the illness...",302020.0,tentacle cell may help virus spread cell following brief roundup latest scientific study novel coronavirus effort find treatment vaccine covid illness...,Mobile & Apps
Planets around nearby star are intriguing candidates for extraterrestrial life,WASHINGTON: Up to three planets - potentially rocky like Earth - have been spotted around a star located relatively near our solar system - a planetary system offering...,272020.0,planet around nearby star intriguing candidate extraterrestrial life washington three planet potentially rocky like earth spotted around star located relatively near solar system planetary system offering...,Mobile & Apps
Subsurface ocean on Jupiter's moon Europa deemed potentially 'habitable',WASHINGTON: Scientists have figured out how the subsurface ocean on Jupiter's moon Europa may have formed and determined that this vast expanse of water may have been able...,272020.0,subsurface ocean jupiter moon europa deemed potentially habitable washington scientist figured subsurface ocean jupiter moon europa may formed determined vast expanse water may able...,Mobile & Apps
Facebook to label all rule-breaking posts - even Trump's,"OAKLAND: Facebook said Friday that it will flag all ""newsworthy"" posts from politicians that break its rules, including those from President Donald Trump.

Separately,...",272020.0,facebook label rule breaking post even trump oakland facebook said friday flag newsworthy post politician break rule including president donald trump. separately ...,Mobile & Apps
University of Queensland's COVID-19 vaccine project to begin recruitment of participants,"KATHMANDU: University of Queensland (UQ) has made a call for recruitment of healthy participants to sort candidates for testing COVID-19 vaccine.

UQ is accelerating its...",192020.0,university queensland covid vaccine project begin recruitment participant kathmandu university queensland uq made call recruitment healthy participant sort candidate testing covid vaccine. uq accelerating its...,Mobile & Apps
Massive spying on users of Google’s Chrome revealed,"SAN FRANCISCO:Â A newly discovered spyware effort attacked users through 32 million downloads of extensions to Googleâ€™s market-leading Chrome web browser, researchers at...",192020.0,massive spying user google chrome revealed san francisco newly discovered spyware effort attacked user million downloads extension google market leading chrome web browser researcher at...,Mobile & Apps
Massive spying on users of Google's Chrome shows new security weakness,"SAN FRANCISCO: A newly discovered spyware effort attacked users through 32 million downloads of extensions to Google's market-leading Chrome web browser, researchers at...",182020.0,massive spying user google chrome show new security weakness san francisco newly discovered spyware effort attacked user million downloads extension google market leading chrome web browser researcher at...,Mobile & Apps
What's your Covid-19 susceptibility? Try the risk calculator to find out,KATHMANDU: A team of researchers have developed a risk calculator to predict an individualâ€™s risk of testing positive for Covid-19 and their outcomes for the...,172020.0,covid susceptibility try risk calculator find kathmandu team researcher developed risk calculator predict individual risk testing positive covid outcome the...,Mobile & Apps
Is Dexamethasone 'the breakthrough' in coronavirus treatment? Research says yes,"KATHMANDU: At a time when there is no generally accepted treatment or vaccine for Covid-19, a team of researchers have made a claim that they've found what could be a...",162020.0,dexamethasone breakthrough coronavirus treatment research say yes kathmandu time generally accepted treatment vaccine covid team researcher made claim found could a...,Mobile & Apps
Coronavirus tracing app a test for privacy-minded Germany,"BERLIN: Germany launched a coronavirus tracing appÂ Tuesday that officials say is so secure even government ministers can use it.

Smartphone apps have been touted as a...",162020.0,coronavirus tracing app test privacy minded germany berlin germany launched coronavirus tracing app tuesday official say secure even government minister use it. smartphone apps touted a...,Mobile & Apps
Does Covid-19 have a bidirectional relation with Diabetes? Let's take a look at what a study has to say,"KATHMANDU: There is a bidirectional relationship between the COVID-19 and diabetes, a UK-based study has suggested.

In an article published in the New England Journal of...",142020.0,covid bidirectional relation diabetes let take look study say kathmandu bidirectional relationship covid diabetes uk based study suggested. article published new england journal of...,Mobile & Apps
Researchers in Chile unearth 74 million-year-old mammal teeth,"SANTIAGO:Â  Chilean and ArgentineÂ researchersÂ haveÂ unearthedÂ teethÂ in far-flung Patagonia belonging to aÂ mammalÂ that livedÂ 74Â millionÂ years ago, theÂ oldest such...",122020.0,researcher chile unearth million year old mammal teeth santiago chilean argentine researcher unearthed teeth far flung patagonia belonging mammal lived million year ago oldest such...,Mobile & Apps
World's largest green turtle colony nearly twice as big as thought,"SYDNEY: TheÂ world'sÂ largestÂ population of nestingÂ greenÂ turtles isÂ nearlyÂ twiceÂ asÂ bigÂ as previouslyÂ thought, scientists said on Wednesday, after drones enabled...",102020.0,world largest green turtle colony nearly twice big thought sydney world largest population nesting green turtle nearly twice big previously thought scientist said wednesday drone enabled...,Mobile & Apps
"IBM quits facial recognition, joins call for police reforms","IBM is getting out of the facial recognition business, saying it's concerned about how the technology can be used for mass surveillance and racial profiling.

Ongoing...",102020.0,ibm quits facial recognition join call police reform ibm getting facial recognition business saying concerned technology used mass surveillance racial profiling. ongoing...,Mobile & Apps
Gilead's remdesivir prevents lung damage in COVID-19 study on monkeys,"Gilead Sciences Inc's antiviral drug remdesivir prevented lung disease in macaque monkeys infected with the new coronavirus, according to a study published in the...",102020.0,gilead remdesivir prevents lung damage covid study monkey gilead science inc antiviral drug remdesivir prevented lung disease macaque monkey infected new coronavirus according study published the...,Mobile & Apps
AstraZeneca accelerates testing of COVID-19 antibody treatments,AstraZeneca said on Tuesday it expects to move two COVID-19 antibody therapies it has licensed from US researchers into clinical studies in the next two months as the...,92020.0,astrazeneca accelerates testing covid antibody treatment astrazeneca said tuesday expects move two covid antibody therapy licensed u researcher clinical study next two month the...,Mobile & Apps
How messaging technology is helping fuel global protests,"When a friend shared a Facebook post with Michelle Burris inviting her to protest in downtown Washington, D.C., last Saturday, she knew she had to go. So she bought a Black...",72020.0,messaging technology helping fuel global protest friend shared facebook post michelle burris inviting protest downtown washington d.c. last saturday knew go. bought black...,Mobile & Apps
Zuckerberg-funded scientists: Rein in hate on Facebook,BOSTON: Dozens of scientists doing research funded by Mark Zuckerberg say Facebook should not be letting President Donald Trump use the social media platform to â€œspread...,72020.0,zuckerberg funded scientist rein hate facebook boston dozen scientist research funded mark zuckerberg say facebook letting president donald trump use social medium platform spread...,Mobile & Apps
"Facebook to apply state media labels on Russian, Chinese outlets","SAN FRANCISCO: Facebook Inc will start labelling Russian, Chinese and other state-controlled media organizations, and later this summer will block any ads from such outlets...",52020.0,facebook apply state medium label russian chinese outlet san francisco facebook inc start labelling russian chinese state controlled medium organization later summer block ad outlets...,Mobile & Apps
"Another astronomical event due on June 5, Asteroid 2020 KA6 to safely fly by Earth","KATHMANDU: 2020 KA6, an Apollo asteroid, will fly by the earth within a distance of 0.02987 au (astronomical units), which is about 4468488.398 kilometres, today at an...",52020.0,another astronomical event due june asteroid ka safely fly earth kathmandu ka apollo asteroid fly earth within distance . au astronomical unit . kilometre today an...,Mobile & Apps
TikTok owner ByteDance shuts down overseas news aggregator TopBuzz,"BEIJING/SHANGHAI: ByteDance, owner of the global hit short-video app TikTok, has shut down its artificial-intelligence-based news aggregator TopBuzz, one of the companyâ€™s...",52020.0,tiktok owner bytedance shuts overseas news aggregator topbuzz beijing shanghai bytedance owner global hit short video app tiktok shut artificial intelligence based news aggregator topbuzz one company s...,Mobile & Apps
Fossilised stomach contents show armoured dinosaur's leafy last meal,"WASHINGTON: In a forest rebounding after a wildfire 110 million years ago, anÂ armouredÂ dinosaur devoured aÂ mealÂ of tender ferns in western Canada before suffering a...",42020.0,fossilised stomach content show armoured dinosaur leafy last meal washington forest rebounding wildfire million year ago armoured dinosaur devoured meal tender fern western canada suffering a...,Mobile & Apps
Oldest and largest ancient Maya structure found in Mexico,WASHINGTON: Scientists using an aerial remote-sensing method have discovered the largest and oldest-knownÂ structureÂ built by the ancientÂ MayaÂ civilisation - a colossal...,42020.0,oldest largest ancient maya structure found mexico washington scientist using aerial remote sensing method discovered largest oldest known structure built ancient maya civilisation colossal...,Mobile & Apps
Facebook takes down white nationalist and fake antifa accounts,SAN FRANCISCO: Facebook Inc (FB.O) said Tuesday it has suspended accounts associated with white nationalist groups after some advocated bringing weapons to the current wave...,32020.0,facebook take white nationalist fake antifa account san francisco facebook inc fb.o said tuesday suspended account associated white nationalist group advocated bringing weapon current wave...,Mobile & Apps
Google takes down Indian app that removed Chinese ones: spokesman,NEW DELHI: Alphabet Incâ€™s Google has taken down an Indian mobile application from its app store that allowed users to remove other Chinese apps from their phones as it...,32020.0,google take indian app removed chinese one spokesman new delhi alphabet inc google taken indian mobile application app store allowed user remove chinese apps phone it...,Mobile & Apps
"Coronavirus study says low humidity aids contagion, will coming humid months help Nepal?","KATHMANDU: A recent study claims that low humidity aids coronavirus outbreak and might recur every year.

The study provides evidence that lower relative humidity is...",22020.0,coronavirus study say low humidity aid contagion coming humid month help nepal kathmandu recent study claim low humidity aid coronavirus outbreak might recur every year. study provides evidence lower relative humidity is...,Mobile & Apps
In-home antibody test shows promise; recovering surgery patients at risk from coronavirus,"The following is a brief roundup of some of the latestÂ scientific studies on the novelÂ coronavirusÂ and efforts to find treatments and vaccines for COVID-19, the illness...",22020.0,home antibody test show promise recovering surgery patient risk coronavirus following brief roundup latest scientific study novel coronavirus effort find treatment vaccine covid illness...,Mobile & Apps
"SpaceX captures the flag, beating Boeing in cosmic contest","CAPE CANAVERAL: The first astronauts launched by SpaceX declared victory Monday in NASAâ€™s cosmic capture-the-flag game.

They quickly claimed the prize left behind at...",22020.0,spacex capture flag beating boeing cosmic contest cape canaveral first astronaut launched spacex declared victory monday nasa cosmic capture flag game. quickly claimed prize left behind at...,Mobile & Apps
SpaceX Crew Dragon delivers two NASA astronauts to International Space Station,"Nearly 24 hours after launching from Florida,Â SpaceX'sÂ CrewÂ DragonÂ capsule delivered NASA astronauts Bob Behnken and Doug Hurley to the International Space Station on...",12020.0,spacex crew dragon delivers two nasa astronaut international space station nearly hour launching florida spacex crew dragon capsule delivered nasa astronaut bob behnken doug hurley international space station on...,Mobile & Apps
India asks internet service providers to block WeTransfer,NEW DELHI: India has ordered its internet service providers (ISPs) to block file-sharing website WeTransfer at a time when hundreds of millions of people are working from...,12020.0,india asks internet service provider block wetransfer new delhi india ordered internet service provider isps block file sharing website wetransfer time hundred million people working from...,Mobile & Apps
SpaceX's historic encore: Astronauts arrive at space station,"CAPE CANAVERAL: SpaceX delivered two astronauts to the International Space Station for NASA on Sunday, following up a historic liftoff with an equally smooth docking in yet...",12020.0,spacex historic encore astronaut arrive space station cape canaveral spacex delivered two astronaut international space station nasa sunday following historic liftoff equally smooth docking yet...,Mobile & Apps
"With fact-checks, Twitter takes on a new kind of task","In addition to disputing misleading claims made by US President Donald Trump about mail-in ballots this week, Twitter has added fact-checking labels to thousands of other...",312020.0,fact check twitter take new kind task addition disputing misleading claim made u president donald trump mail ballot week twitter added fact checking label thousand other...,Mobile & Apps
NASA resumes human spaceflight from US soil with historic SpaceX launch,"CAPE CANAVERAL: SpaceX, the private rocket company of billionaire entrepreneur Elon Musk, launched two Americans into orbit from Florida on Saturday in a landmark mission...",312020.0,nasa resume human spaceflight u soil historic spacex launch cape canaveral spacex private rocket company billionaire entrepreneur elon musk launched two american orbit florida saturday landmark mission...,Mobile & Apps
Google postpones Android 11 unveiling amid US protests,Alphabet Incâ€™s Google on Saturday said it has postponed next weekâ€™s planned unveiling of the beta version of its latest Android 11 mobile operating system in light of...,302020.0,google postpones android unveiling amid u protest alphabet inc google saturday said postponed next week planned unveiling beta version latest android mobile operating system light of...,Mobile & Apps
Take 2 for SpaceX's 1st astronaut launch with more storms,"CAPE CANAVERAL, FLORIDA: SpaceX pressed ahead with its second attempt to launch astronauts for NASA â€” a historic first for a private company â€” but more stormy weather...",302020.0,take spacex st astronaut launch storm cape canaveral florida spacex pressed ahead second attempt launch astronaut nasa historic first private company stormy weather...,Mobile & Apps
GSK says science does not link pandemic H1N1 flu vaccine to sleep disorder,"LONDON: British drugmaker GSK said on Thursday that its previousÂ fluÂ pandemicÂ vaccine, which used some of the same ingredients as COVID-19Â vaccines currently under...",282020.0,gsk say science link pandemic hn flu vaccine sleep disorder london british drugmaker gsk said thursday previous flu pandemic vaccine used ingredient covid vaccine currently under...,Mobile & Apps
"Google sees resurgence in state-backed hacking, phishing related to COVID-19","Security experts at Alphabet Inc's Google sent 1,755 warnings in April to users whose accounts were targets of government-backed attackers, following a resurgence in...",282020.0,google see resurgence state backed hacking phishing related covid security expert alphabet inc google sent warning april user whose account target government backed attacker following resurgence in...,Mobile & Apps
"In lean times, fierce dinosaur Allosaurus resorted to cannibalism","WASHINGTON: The dreadedÂ dinosaurÂ AllosaurusÂ was the scourge of the Jurassic Period landscape some 150 million years ago, an apex predator just as Tyrannosaurus rex was...",282020.0,lean time fierce dinosaur allosaurus resorted cannibalism washington dreaded dinosaur allosaurus scourge jurassic period landscape million year ago apex predator tyrannosaurus rex was...,Mobile & Apps
Weather postpones SpaceX's first astronaut launch from Florida,"CAPE CANAVERAL, FLORIDA: StormyÂ weatherÂ thwarted a landmark moment for private rocket company SpaceX and NASA on Wednesday, forcingÂ launchÂ directors inÂ FloridaÂ to...",282020.0,weather postpones spacex first astronaut launch florida cape canaveral florida stormy weather thwarted landmark moment private rocket company spacex nasa wednesday forcing launch director florida to...,Mobile & Apps
Ominous weather looms as NASA set to resume human spaceflight with SpaceX takeoff,CAPE CANAVERAL -TwoÂ NASAÂ astronauts arrived at a Florida launch pad flashing thumbs-up signs as they prepared to be carried into orbit on Wednesday by billionaire...,282020.0,ominous weather loom nasa set resume human spaceflight spacex takeoff cape canaveral two nasa astronaut arrived florida launch pad flashing thumb sign prepared carried orbit wednesday billionaire...,Mobile & Apps
Collision of galaxies may have spurred our solar system's formation,"WASHINGTON: A violent event on a colossal scale - the crash of two galaxies - may have paved the way for our solar system's birth.

A star-formation binge in the Milky...",272020.0,collision galaxy may spurred solar system formation washington violent event colossal scale crash two galaxy may paved way solar system birth. star formation binge milky...,Mobile & Apps
Weather better for historic SpaceX launch of NASA astronauts,"CAPE CANAVERAL: With the weather looking up, SpaceX and NASA officials vowed Tuesday to keep crew safety the top priority for the nation's first astronaut launch to orbit...",272020.0,weather better historic spacex launch nasa astronaut cape canaveral weather looking spacex nasa official vowed tuesday keep crew safety top priority nation first astronaut launch orbit...,Mobile & Apps
India makes source code of contact-tracing app public,"NEW DELHI: India said on Tuesday it was making public the source code of its coronavirus contact-tracing app Aarogya Setu for Googleâ€™s (GOOGL.O) Android smartphones, a...",272020.0,india make source code contact tracing app public new delhi india said tuesday making public source code coronavirus contact tracing app aarogya setu google googl.o android smartphones a...,Mobile & Apps
Digital contact tracing to fight COVID-19,"KATHMANDU: In the wake of COVID-19 pandemic, applications to enable digital contact tracing of the disease are being rolled out around the world. At the onset of May, New...",252020.0,digital contact tracing fight covid kathmandu wake covid pandemic application enable digital contact tracing disease rolled around world. onset may new...,Mobile & Apps
First commercial space taxi a pit stop on Musk's Mars quest,"It all started with the dream of growing a rose on Mars.

That vision, Elon Musk's vision, morphed into a shake-up of the old space industry, and a fleet of new private...",242020.0,first commercial space taxi pit stop musk mar quest started dream growing rose mars. vision elon musk vision morphed shake old space industry fleet new private...,Mobile & Apps
"Hydroxychloroquine shows no virus benefit, raises death risk: Study","Paris, May 22

A study of nearly 100,000 coronavirus patients has shown no benefit in treating them with anti-viral drugs hydroxychloroquine and chloroquine and even...",232020.0,hydroxychloroquine show virus benefit raise death risk study paris may study nearly coronavirus patient shown benefit treating anti viral drug hydroxychloroquine chloroquine even...,Mobile & Apps
